{
  "$id": "https://github.com/mbta/schemas/blob/main/schemas/com.mbta.ocs.tsch_con.v1.json",
  "$schema": "https://json-schema.org/draft/2020-12/schema",
  "description": "OCS TSCH message about updating a train consist",
  "type": "object",
  "properties": {
    "id": {
      "$ref": "cloudevents.json#/properties/id",
      "examples": ["prLSlfYXlQ8Nmsa8gyVi6PPZUmA="]
    },
    "source": {
      "$ref": "cloudevents.json#/properties/source",
      "examples": ["mbta.com/trike-12345"]
    },
    "specversion": {
      "const": "1.0",
      "$ref": "cloudevents.json#/properties/specversion"
    },
    "type": {
      "const": "com.mbta.ocs.tsch_con.v1",
      "$ref": "cloudevents.json#/properties/type"
    },
    "time": {
      "$ref": "cloudevents.json#/properties/time"
    },
    "partitionkey": {
      "type": "string",
      "minLength": 1,
      "description": "Key used to balance messages across multiple shards"
    },
    "data": {
      "description": "The event payload.",
      "$ref": "#/$defs/datadef"
    }
  },
  "required": [
    "id",
    "source",
    "specversion",
    "type",
    "data",
    "time",
    "partitionkey"
  ],
  "$defs": {
    "datadef": {
      "type": "object",
      "allOf": [
        { "$ref": "ocs-events-common.json#/$defs/tschCommonBase" },
        {
          "required": ["tripUid", "consist", "trainUid"],
          "properties": {
            "tripUid": {
              "description": "Trip UID - only unique within a transit line.",
              "type": "string"
            },
            "consist": {
              "description": "Train car numbers in consist (No train tags), as physically displayed on cars (e.g. red line 15xx).",
              "type": "array",
              "items": {
                "type": "string"
              }
            },
            "consistInternal": {
              "description": "Optional: Train car numbers in consist (No train tags), as stored internally by OCS (e.g. red line 25xx). Provided only if at least one car differs from its physical numbering.",
              "type": "array",
              "items": {
                "type": "string"
              }
            },
            "trainUid": {
              "description": "Unique ID for the occupancy moving around the system. Only unique within a transit line.",
              "type": "string"
            }
          }
        }
      ]
    }
  }
}
