{
  "id": "prLSlfYXlQ8Nmsa8gyVi6PPZUmA=",
  "partitionkey": "{10.0.0.28:8081 -> 10.0.0.2:65473}",
  "source": "ctd.mbta.com/trike-1234",
  "specversion": "1.0",
  "time": "2023-01-29T13:51:54.990000Z",
  "type": "com.mbta.ocs.tsch_con.v1",
  "data": {
    "counter": 70877,
    "timestamp": "2025-06-06T13:17:37.632951-04:00",
    "transitLine": "R",
    "tripUid": "981498C2",
    "consist": ["2507", "2506", "1726", "1727", "1702", "1703"],
    "consistDisplay": ["1507", "1506", "1726", "1727", "1702", "1703"],
    "trainUid": "54838C33"
  }
}
